{
  "eventId": "sec_a1b2c3d4e5f60007",
  "type": "FirmwareDowngradeAttempt",
  "severity": "Warning",
  "timestamp": "2026-03-01T14:30:00.000Z",
  "details": {
    "currentVersion": "2.4.0",
    "offeredVersion": "2.3.1",
    "forceDowngrade": false,
    "description": "Firmware downgrade rejected: 2.3.1 < 2.4.0"
  }
}
