{
  "eventId": "sec_a1b2c3d4e5f60005",
  "type": "BruteForceAttempt",
  "severity": "Warning",
  "timestamp": "2026-03-01T11:00:00.000Z",
  "details": {
    "failedAttempts": 5,
    "windowSeconds": 60,
    "sourceIp": "192.168.1.150",
    "description": "5 consecutive authentication failures within 60 seconds"
  }
}
