{
  "eventId": "sec_a1b2c3d4e5f60001",
  "type": "ClockSkew",
  "severity": "Warning",
  "timestamp": "2026-03-01T12:00:05.000Z",
  "details": {
    "driftSeconds": 342,
    "serverTime": "2026-03-01T12:00:00.000Z",
    "stationTime": "2026-03-01T11:54:18.000Z",
    "description": "Clock drift detected: 342 seconds"
  }
}
